role,skills
Data Scientist,Python machine learning statistics data analysis pandas scikit-learn numpy
Cloud Engineer,Cloud computing AWS Azure DevOps Linux networks Docker Kubernetes
Automation Specialist,Python automation scripting Selenium bash robotics scraping Jenkins
Web Developer,HTML CSS JavaScript React frontend backend node express git
Robotics Engineer,Arduino robotics ROS C++ microcontrollers sensors hardware servo
Embedded Systems Developer,C embedded firmware microcontrollers Arduino RTOS PCB hardware SPI